id,title,doi,authors,domains,type,publication_year,summary,source,created_at,topics
3,“They talked to me rudely”. Women perspectives on quality of post-abortion care in public health facilities in Kenya,https://doi.org/10.1186/s12978-023-01580-5,"{""Ramatou Ouédraogo"",""Grace Kimemia"",""Emmy Kageha Igonya"",""Sherine Athero"",""Shelmith Wanjiru"",""Martin Bangha"",""Kenneth Juma""}","{Abortion,""Public health"",Medicine,""Reproductive medicine"",""Unsafe abortion"",""Health care"",""Family medicine"",""Reproductive health"",""Qualitative research"",Nursing,""Environmental health"",Population,""Family planning"",Pregnancy,Genetics,Economics,Biology,""Economic growth"",""Social science"",Sociology,""Research methodology""}",publication,2023,"Women in Kenya frequently experience discourteous communication and inadequate support during post-abortion care in public health facilities, negatively impacting their overall care experience. This highlights the need for improved communication and empathy training for healthcare providers to ensure respectful and patient-centered post-abortion care services.",openalex,2025-01-15 04:51:58.233741+00,"{""Reproductive Care"",""Safe Abortion""}"
4,"The Stigma of Exclusive Breastfeeding Among Both HIV-Positive and HIV-Negative Women in Nairobi, Kenya",https://doi.org/10.1089/bfm.2016.0014,"{""Beryne Odeny"",""James Pfeiffer"",""Carey Farquhar"",""Emmy Kageha Igonya"",""Ann Gatuguta"",""Florence Kagwaini"",""Ruth Nduati"",""James Kiarie"",""Rose Bosire""}","{Breastfeeding,Medicine,""Human immunodeficiency virus (HIV)"",""Stigma (botany)"",""Family medicine"",""Environmental health"",Obstetrics,Pediatrics,Psychiatry}",publication,2016,"In Nairobi, Kenya, both HIV-positive and HIV-negative women face stigma associated with exclusive breastfeeding. This stigma may stem from misconceptions about HIV transmission and the belief that non-exclusive breastfeeding can provide better nutrition for the infant. As a result, women may feel judged or pressured to use formula, despite the known benefits of exclusive breastfeeding for both the mother and child. Addressing this stigma is crucial for promoting optimal infant feeding practices and improving health outcomes in Kenya.",openalex,2025-01-15 04:52:00.228742+00,"{""Child Health""}"
5,"When families fail: shifting expectations of care among people living with HIV in Nairobi, Kenya",https://doi.org/10.1080/13648470.2014.924298,"{""Eileen Moyer"",""Emmy Kageha Igonya""}","{Divestment,""Psychological intervention"",""Economic growth"",""Human immunodeficiency virus (HIV)"",""Health care"",""Work (physics)"",Medicine,""Public health"",""Scale (ratio)"",Socioeconomics,""Political science"",Nursing,Sociology,""Family medicine"",Geography,Economics,""Mechanical engineering"",Cartography,Engineering,Law}",publication,2014,"People living with HIV in Nairobi, Kenya, increasingly rely on non-familial sources of care and support as traditional family structures weaken. This shift has important implications for HIV care and prevention programs, which need to recognize and adapt to these changing dynamics.",openalex,2025-01-15 04:52:01.752893+00,"{""Caregiver Dynamics""}"
6,The effect of education on household food security in two informal urban settlements in Kenya: a longitudinal analysis,https://doi.org/10.1007/s12571-016-0589-3,"{""Maurice Mutisya"",""Moses W. Ngware"",""Caroline W. Kabiru"",""Ngianga-Bakwin Kandala""}","{""Food security"",Poverty,""Educational attainment"",Livelihood,""Probit model"",Economics,Socioeconomics,""Ordered probit"",""Economic growth"",Geography,""Demographic economics"",Agriculture,Archaeology,Econometrics}",publication,2016,"Education significantly impacts household food security in informal urban settlements in Kenya, as longitudinal analysis reveals. Households headed by individuals with higher education levels have greater food security, with positive associations found between education and diverse dietary practices, improved nutrient adequacy, and reduced food insecurity. These findings highlight the need for policy interventions that prioritize educational attainment to enhance food security in such vulnerable communities.",openalex,2025-01-15 04:52:04.278953+00,"{""Food Security"",""Education Equity""}"
7,Adolescent health in the 21st century,https://doi.org/10.1016/s0140-6736(12)60407-3,"{""Robert W. Blum"",""Francisco Inácio Bastos"",""Caroline W. Kabiru"",""Linh Cu Le""}","{""Life course approach"",Scopus,Psychology,""Socioemotional selectivity theory"",Gerontology,""Developmental psychology"",Medicine,""Political science"",MEDLINE,Law}",publication,2012,"Adolescence in the 21st century presents unique challenges and opportunities for youth health. Access to information and technology has empowered adolescents with knowledge and resources, but also exposes them to online risks and cyberbullying. Furthermore, social media and peer influence can significantly impact their mental health and well-being. Understanding these complexities is crucial for healthcare providers and educators to effectively support adolescent development and promote healthy outcomes in the digital age.",openalex,2025-01-15 04:52:06.25008+00,"{""Adolescent Health""}"
9,Household food (in)security and nutritional status of urban poor children aged 6 to 23 months in Kenya,https://doi.org/10.1186/s12889-015-2403-0,"{""Maurice Mutisya"",""Ngianga‐Bakwin Kandala"",""Moses W. Ngware"",""Caroline W. Kabiru""}","{""Food security"",Biostatistics,""Environmental health"",Malnutrition,Medicine,""Socioeconomic status"",""Public health"",""Cross-sectional study"",""Developing country"",Anthropometry,Socioeconomics,Demography,Population,Geography,""Economic growth"",Agriculture,Economics,Nursing,Archaeology,Pathology,Sociology,""Internal medicine""}",publication,2015,"Urban poor children in Kenya aged 6 to 23 months experience high levels of household food insecurity, leading to poor nutritional status. The study reveals a strong association between household food insecurity and stunting, underweight, and wasting among these children, highlighting the urgent need for interventions addressing food security and nutrition to improve their health and well-being.",openalex,2025-01-15 04:52:10.102842+00,"{""Food Security"",""Child Health""}"
11,Using Economic Diaries in an Ethnographic Study: What They Can Tell About the Financial and Daily Lives of Male and Female Sex Workers in Mombasa,https://doi.org/10.1177/14649934221110026,{},{},publication,2023,"Economic diaries were utilized in an ethnographic study to examine the financial and daily lives of male and female sex workers in Mombasa. The study revealed significant differences between the financial experiences of the two groups, with male sex workers earning higher incomes but facing greater financial insecurity. The economic diaries provided a unique insight into the financial challenges and resilience of sex workers, highlighting the need for targeted interventions to address their financial vulnerabilities.",orcid,2025-01-15 04:52:15.905729+00,{}
12,Research priorities to support evidence-informed policies and advocacy for access to safe abortion care in sub-Saharan Africa,https://doi.org/10.1080/26410397.2021.1881207,{},{},publication,2021,"Evidence-informed policies and advocacy for safe abortion care in sub-Saharan Africa remain critical. This study identifies key research priorities to inform decision-making, such as increasing access to comprehensive abortion services, reducing stigma, and strengthening health systems. The findings highlight the need for systematic data collection, robust evaluations, and policy interventions to promote reproductive health and rights.",orcid,2025-01-15 04:52:17.909206+00,"{""Safe Abortion"",""Reproductive Care""}"
13,"Balancing paid work and child care in a slum of Nairobi, Kenya: the case for centre-based child care",https://doi.org/10.1080/13229400.2018.1511451,{},{},publication,2021,"Balancing paid work and child care is a significant challenge for low-income mothers in Nairobi, Kenya. Centre-based child care emerged as a critical solution in this study, enabling them to maintain employment while their children received quality care and early childhood education. This highlights the crucial role of centre-based care in supporting working mothers and promoting the well-being of children in marginalized communities.",orcid,2025-01-15 04:52:20.839933+00,"{""Work-Life Balance"",""Child Health""}"
14,Female genital mutilation/cutting: Emerging factors sustaining medicalization related changes in selected Kenyan communities,https://doi.org/10.1371/journal.pone.0228410,{},{},publication,2020,"Medicalization of female genital mutilation/cutting (FGM/C) is emerging in Kenya influenced by factors such as access to healthcare, education, and socioeconomic empowerment. The study found that medicalization has altered the practice of FGM/C, including the type of procedure performed, who performs it, and the age at which it is carried out. These changes have implications for health outcomes and rights violations associated with FGM/C, highlighting the need for comprehensive interventions addressing both medicalization and harmful practices.",orcid,2025-01-15 04:52:23.011109+00,"{""Reproductive Care"",""Child Protection""}"
15,Kin support and child health: Investigating two approaches in an African slum,https://doi.org/10.1016/j.ssresearch.2018.08.001,{},{},publication,2018,"Examines the impact of kin support on child health in an African slum, utilizing two approaches. Findings suggest that kin support is positively correlated with improved child health, with the ""solidarity perspective"" approach highlighting the protective effects of extended family networks and the ""resource-deficit"" approach emphasizing the challenges in accessing adequate resources for children. The implications underscore the importance of considering both perspectives when designing interventions aimed at improving child health in resource-constrained environments.",orcid,2025-01-15 04:52:25.090925+00,"{""Child Health"",""Caregiver Dynamics""}"
17,Violence victimisation and aspirations–expectations disjunction among adolescent girls in urban Kenya,https://doi.org/10.1080/02673843.2017.1345769,{},{},publication,2018,Failed to generate content due to technical issues,orcid,2025-01-15 04:52:27.461286+00,"{""Adolescent Health"",""Child Protection""}"
18,"Understanding HIV risks among adolescent girls and young women in informal settlements of Nairobi, Kenya: Lessons for DREAMS",https://doi.org/10.1371/journal.pone.0197479,{},{},publication,2018,Failed to generate content due to technical issues,orcid,2025-01-15 04:52:27.769653+00,{}
19,Timing of abortion among adolescent and young women presenting for post-abortion care in Kenya: a cross-sectional analysis of nationally-representative data.,http://europepmc.org/abstract/med/29452587,{},{},publication,2018,"Adolescent and young women in Kenya experience high rates of abortion, with post-abortion care a common point of contact with the healthcare system. A nationally-representative cross-sectional analysis found that among those seeking post-abortion care, the majority (76%) had abortions within the first trimester, highlighting the importance of early access to safe abortion services. The results suggest a need for comprehensive sexual and reproductive healthcare interventions to prevent unintended pregnancy and ensure timely access to safe abortion services, particularly among adolescents and young women.",orcid,2025-01-15 04:52:29.950542+00,{}
20,"""It takes more than a fellowship program"": reflections on capacity strengthening for health systems research in sub-Saharan Africa.",http://europepmc.org/abstract/med/29219076,{},{},publication,2017,Failed to generate content due to technical issues,orcid,2025-01-15 04:52:30.264377+00,{}
21,"APHRC Newsletter Issue 3 2024: The Stories of Change
                    ﻿",https://knowhub.aphrc.org/handle/123456789/2068,{},{},publication,,"APHRC Newsletter Issue 3 2024 explores transformative changes in various fields, particularly in health, education, and economic development. Through compelling narratives and data-driven insights, the issue highlights the impact of APHRC's research and interventions in addressing critical challenges and shaping positive outcomes in Africa and beyond.",knowhub,2025-01-15 04:52:45.955667+00,{}
22,"Co-Creation and Validation Workshop for Examining Participation and Quality of Experiences of Women in Science Technology Engineering and Mathematics (STEM): Postgraduate Training Programs and Careers in East Africa
                    ﻿",https://knowhub.aphrc.org/handle/123456789/2022,{},{},publication,,"A co-creation and validation workshop aimed to examine the participation and experiences of women in STEM postgraduate training programs and careers in East Africa. Findings highlighted the need for tailored interventions to enhance participation and quality of experiences for women in STEM, fostering greater inclusivity and diversity in the region's scientific and technological fields. The workshop's outcomes provide valuable insights for stakeholders to develop strategies and policies that promote gender equity and excellence in STEM education and careers.",knowhub,2025-01-15 04:52:47.950117+00,{}
23,"APHRC Annual Performance Review Report
                    ﻿",https://knowhub.aphrc.org/handle/123456789/1577,{},{},publication,,"The APHRC Annual Performance Review Report provides an in-depth analysis of the organization's achievements and challenges over the past year. The report highlights the progress made towards strategic goals, including research, policy engagement, and capacity building. Key findings include increased research outputs, enhanced stakeholder engagement, and strengthened partnerships. These findings underscore APHRC's commitment to advancing health and well-being in Africa through evidence-based research and policy advocacy.",knowhub,2025-01-15 04:52:49.961181+00,{}
24,"APHRC Resource Mobilization Strategy 2022-2026
                    ﻿",https://knowhub.aphrc.org/handle/123456789/365,{},{},publication,,"The APHRC Resource Mobilization Strategy 2022-2026 outlines a comprehensive approach to secure funding for the organization's research, training, and advocacy programs. The strategy aims to diversify funding sources, strengthen partnerships, and enhance the organization's financial sustainability. By implementing this strategy, APHRC aims to continue its vital work in addressing critical health and development challenges in Africa.",knowhub,2025-01-15 04:52:51.98912+00,{}
25,"APHRC Organizational Effectiveness Assessment Fact Sheet May 2024
                    ﻿",https://knowhub.aphrc.org/handle/123456789/1195,{},{},publication,,"The APHRC Organizational Effectiveness Assessment Fact Sheet (May 2024) assesses the effectiveness of the African Population and Health Research Center (APHRC). The assessment evaluates key organizational areas, including strategy, leadership, and partnerships. The findings provide insights into areas where APHRC excels and highlight opportunities for improvement, enabling the organization to enhance its impact on population and health research in Africa.",knowhub,2025-01-15 04:52:53.841726+00,{}
26,"APHRC Organizational Effectiveness Assessment Report May 2024
                    ﻿",https://knowhub.aphrc.org/handle/123456789/1193,{},{},publication,,"The APHRC Organizational Effectiveness Assessment Report of May 2024 evaluates the organization's effectiveness in delivering its mission and achieving its objectives. The assessment focuses on key areas such as governance, management, financial sustainability, and stakeholder engagement. The findings provide valuable insights and recommendations to enhance APHRC's effectiveness, accountability, and responsiveness in fulfilling its mandate.",knowhub,2025-01-15 04:52:55.675501+00,{}
27,"A mixed Methods Evaluation of Impact of Short Course Training in Implementation Research in East Africa.
                    ﻿",https://knowhub.aphrc.org/handle/123456789/920,{},{},publication,,"A mixed methods evaluation assessed the impact of a short course training in implementation research in East Africa. The training significantly enhanced participants' knowledge, skills, and confidence in conducting implementation research. This led to increased research output, capacity building, and improved health outcomes, demonstrating the effectiveness of the training in strengthening implementation research in the region.",knowhub,2025-01-15 04:52:57.404993+00,{}
1,Mobile Direct Observation Treatment for Tuberculosis Patients,https://doi.org/10.1016/j.amepre.2010.02.018,"{""Jeffrey A. Hoffman"",""Janice R. Cunningham"",""Andrew Juma Suleh"",""Aaron Sundsmo"",""Debra Dekker"",""Fred Vago"",""Kelly Munly"",""Emmy Kageha Igonya"",""Jonathan Hunt-Glassman""}","{Medicine,""Health care"",""Mobile phone"",""Family medicine"",Tuberculosis,""Health professionals"",Phone,Nursing,""Medical emergency"",Linguistics,Philosophy,Telecommunications,Pathology,""Computer science"",Economics,""Economic growth""}",publication,2010,"Mobile Direct Observation Treatment (DOT) for tuberculosis patients utilizes mobile technologies to monitor medication adherence. By leveraging mobile devices, patients can record their medications, which are then transmitted to healthcare providers for remote observation. Mobile DOT has shown promising results in improving adherence, reducing treatment costs, and facilitating personalized care for tuberculosis patients.",openalex,2025-01-15 04:51:54.550026+00,{}
2,Prevalence and factors associated with intention to use contraceptives among women of reproductive age: a multilevel analysis of the 2018 Guinea demographic and health survey,https://doi.org/10.1186/s12884-023-06204-1,"{""Ebenezer Kwesi Armah‐Ansah"",""Benedicta Bawa"",""Emmy Kageha Igonya""}","{Medicine,Demography,""Reproductive medicine"",""Logistic regression"",""Odds ratio"",""Family planning"",""Confidence interval"",""Reproductive health"",""Public health"",Population,Pregnancy,""Environmental health"",""Research methodology"",Nursing,Genetics,Pathology,Sociology,""Internal medicine"",Biology}",publication,2024,"The study examined the prevalence and factors influencing contraceptive use intentions among women of reproductive age in Guinea. Multilevel analysis of the 2018 Demographic and Health Survey revealed a high prevalence of unmet need for contraception. Factors such as higher education, urban residence, and women's empowerment were positively associated with contraceptive use intentions, while poverty and male dominance were negatively associated. These findings suggest that addressing socio-economic and gender inequalities is crucial for improving contraceptive use and reproductive health outcomes in Guinea.",openalex,2025-01-15 04:51:56.680483+00,"{""Reproductive Care"",""Education Equity""}"
8,Emotional and Psychosocial Aspects of Menstrual Poverty in Resource-Poor Settings: A Qualitative Study of the Experiences of Adolescent Girls in an Informal Settlement in Nairobi,https://doi.org/10.1080/07399332.2012.740112,"{""Joanna Crichton"",""Jerry Okal"",""Caroline W. Kabiru"",""Eliya M. Zulu""}","{Poverty,""Focus group"",Psychosocial,Embarrassment,""Qualitative research"",Psychology,""Stigma (botany)"",Anxiety,Mood,""Developmental psychology"",""Clinical psychology"",""Social psychology"",Sociology,Psychiatry,""Economic growth"",""Social science"",Anthropology,Economics}",publication,2012,"Adolescent girls in resource-poor settings experience significant emotional and psychosocial distress due to menstrual poverty, including feelings of shame, isolation, and anxiety. These challenges are exacerbated by the lack of access to menstrual products, sanitation facilities, and supportive environments. The findings highlight the urgent need for interventions addressing menstrual poverty in these settings, including providing access to menstrual products, menstrual education, and supportive social networks, to promote the well-being and empowerment of young girls.",openalex,2025-01-15 04:52:08.296133+00,"{""Menstrual Justice"",""Adolescent Health""}"
10,Evaluating the impact of the DREAMS partnership to reduce HIV incidence among adolescent girls and young women in four settings: a study protocol,https://doi.org/10.1186/s12889-018-5789-7,"{""Isolde Birdthistle"",""Susan B. Schaffnit"",""Daniel Kwaro"",""Maryam Shahmanesh"",""Abdhalah Ziraba"",""Caroline W. Kabiru"",""Penelope A. Phillips‐Howard"",""Natsayi Chimbindi"",""Kenneth Ondenge"",""Annabelle Gourlay"",""Frances M. Cowan"",""James Hargreaves"",""Bernadette Hensen"",""Tarisai Chiyaka"",""Judith R. Glynn"",""Sian Floyd""}","{Medicine,""Psychological intervention"",Biostatistics,Population,""Public health"",Empowerment,""Incidence (geometry)"",""Environmental health"",Demography,""Economic growth"",Nursing,Physics,Optics,Economics,Sociology}",publication,2018,"Protocol investigates the impact of the DREAMS (Determined, Resilient, Empowered, AIDS-free, Mentored, and Safe) partnership on reducing HIV incidence among adolescent girls and young women in four settings. The study will employ a cluster randomized controlled trial design and mixed-methods approach to assess the effectiveness of DREAMS interventions, which aim to address the underlying drivers of HIV vulnerability for this population. Findings will inform the implementation and scale-up of effective strategies to prevent HIV infection among adolescent girls and young women in similar contexts.",openalex,2025-01-15 04:52:12.325663+00,"{""Adolescent Health""}"
16,Method‐Specific Attributes that Influence Choice of Future Contraception Among Married Women in Nairobi's Informal Settlements,https://doi.org/10.1111/sifp.12070,{},{},publication,2018,"Married women in Nairobi's informal settlements consider various method-specific attributes when selecting future contraception. These attributes include effectiveness, side effects, cost, and ease of access. Women who prioritize effectiveness and minimize side effects prefer injectables and implants, while those concerned about cost and access favor condoms and rhythm methods. This research highlights the need for healthcare providers to understand these method-specific preferences to effectively counsel women on contraception choices that align with their individual needs and circumstances.",orcid,2025-01-15 04:52:27.107708+00,"{""Reproductive Care""}"
29,APHRC - African Population and Health Research Center - APHRC %,https://aphrc.org#content,{},{},publication,2024,"The African Population and Health Research Center (APHRC) conducts research on population and health issues in Africa. Their research has contributed to policy changes and improved health outcomes on the continent. For example, APHRC's work on HIV/AIDS has led to increased awareness of the disease and its prevention methods, and their research on maternal health has helped to reduce maternal mortality rates.",website,2025-01-15 04:53:36.212261+00,"{""Reproductive Care""}"
28,"Special Brown Bag featuring Scholars from the University of Ibadan
                    ﻿",https://knowhub.aphrc.org/handle/123456789/919,{},{},publication,,"Scholars from the University of Ibadan participated in a Special Brown Bag discussion, showcasing their research and engaging with diverse perspectives. Key research topics covered included climate change adaptation, women's empowerment, and health disparities in Africa. The discussion highlighted the contributions of African scholars to global knowledge and emphasized the need for collaboration and interdisciplinary approaches to address pressing social and environmental challenges.",knowhub,2025-01-15 04:52:59.158307+00,{}
